### ISSUE TITLE
Random crashes

### ISSUE THREAD

**Issue by Spaghetti-jpg** [Seji64/SniDust#40]
What other logs should I provide?

```
cat docker-compose.yml
version: '3.3'
services:
    snidust:
        container_name: snidust
        image: 'ghcr.io/seji64/snidust:main'
        environment:
            - ALLOWED_CLIENTS=0.0.0.0/0
            - EXTERNAL_IP=SERVER IP
            - SPOOF_ALL_DOMAINS=false
        ports:
            - 443:443
            - 80:80
            - 53:5300/udp
        volumes:
            - '~/SniDust/99-custom.lst:/etc/snidust/domains.d/99-custom.lst:ro'
```

```
docker-compose logs snidust
Attaching to snidust
snidust    | [INFO] Dnsdist webserver password not set - generating one
snidust    | [INFO] Generated WebServer Password: Dm55GGhTGs0c
snidust    | [INFO] Dnsdist webserver api key not set - generating one
snidust    | [INFO] Generated WebServer API Key: EKBzYs_9rUv6ZE93EIRB9bokUJNVaF_Y
snidust    | [INFO] Generating ACL...
snidust    | [INFO] Generating DNSDist Configs...
snidust    | [INFO] Starting DNSDist...
snidust    | [INFO] Starting sniproxy
snidust    | [INFO] Using SERVER IP - Point your DNS settings to this address
snidust    | 2024-02-16T23:37:11Z INF starting sniproxy. version v2.0.4, commit eecf94a0e8df7eaaaa9946fd21f80e392c9642cdsnidust    | dnsdist 1.8.2 comes with ABSOLUTELY NO WARRANTY. This is free software, and you are welcome to redistribute it according to the terms of the GPL version 2
snidust    | [INFO] [SniDust] *** Loading Domain Lists... ***
snidust    | [INFO] [SniDust] *** Domain List: /etc/snidust/domains.d/00-debug.lst***
snidust    | [INFO] [SniDust] Adding domain myip.is to list
snidust    | [INFO] [SniDust] Adding domain ifconfig.co to list
snidust    | [INFO] [SniDust] *** End of Domain List ***
snidust    | [INFO] [SniDust] *** Domain List: /etc/snidust/domains.d/01-cdn_akamai.lst***
snidust    | [INFO] [SniDust] Adding domain akadns.net to list
snidust    | [INFO] [SniDust] Adding domain akam.net to list
snidust    | [INFO] [SniDust] Adding domain akamai.com to list
snidust    | [INFO] [SniDust] Adding domain akamai.net to list
snidust    | [INFO] [SniDust] Adding domain akamaiedge.net to list
snidust    | [INFO] [SniDust] Adding domain akamaihd.net to list
snidust    | [INFO] [SniDust] Adding domain akamaistream.net to list
snidust    | [INFO] [SniDust] Adding domain akamaitech.net to list
snidust    | [INFO] [SniDust] Adding domain akamaitechnologies.com to list
snidust    | [INFO] [SniDust] Adding domain akamaitechnologies.fr to list
snidust    | [INFO] [SniDust] Adding domain akamaized.net to list
snidust    | [INFO] [SniDust] *** End of Domain List ***
snidust    | [INFO] [SniDust] *** Domain List: /etc/snidust/domains.d/02-amazon.lst***
snidust    | [INFO] [SniDust] Adding domain amazon.com to list
snidust    | [INFO] [SniDust] Adding domain amazon.co.uk to list
snidust    | [INFO] [SniDust] Adding domain amazonvideo.com to list
snidust    | [INFO] [SniDust] *** End of Domain List ***
snidust    | [INFO] [SniDust] *** Domain List: /etc/snidust/domains.d/03-hbo.lst***
snidust    | [INFO] [SniDust] Adding domain hbonow.com to list
snidust    | [INFO] [SniDust] Adding domain hbogo.com to list
snidust    | [INFO] [SniDust] Adding domain hbo.com to list
snidust    | [INFO] [SniDust] *** End of Domain List ***
snidust    | [INFO] [SniDust] *** Domain List: /etc/snidust/domains.d/04-hulu.lst***
snidust    | [INFO] [SniDust] Adding domain hulu.com to list
snidust    | [INFO] [SniDust] Adding domain huluim.com to list
snidust    | [INFO] [SniDust] *** End of Domain List ***
snidust    | [INFO] [SniDust] *** Domain List: /etc/snidust/domains.d/05-netflix.lst***
snidust    | [INFO] [SniDust] Adding domain netflix.com to list
snidust    | [INFO] [SniDust] Adding domain netflix.de to list
snidust    | [INFO] [SniDust] Adding domain nflximg.net to list
snidust    | [INFO] [SniDust] Adding domain nflximg.com to list
snidust    | [INFO] [SniDust] Adding domain nflxvideo.net to list
snidust    | [INFO] [SniDust] Adding domain netflix.net to list
snidust    | [INFO] [SniDust] Adding domain nflximg.net to list
snidust    | [INFO] [SniDust] Adding domain nflxvideo.net to list
snidust    | [INFO] [SniDust] Adding domain nflxso.net to list
snidust    | [INFO] [SniDust] Adding domain nflxext.com to list
snidust    | [INFO] [SniDust] *** End of Domain List ***
snidust    | [INFO] [SniDust] *** Domain List: /etc/snidust/domains.d/06-molotov_tv.lst***
snidust    | [INFO] [SniDust] Adding domain molotov.tv to list
snidust    | [INFO] [SniDust] *** End of Domain List ***
snidust    | [INFO] [SniDust] *** Domain List: /etc/snidust/domains.d/07-srf_ch.lst***
snidust    | [INFO] [SniDust] Adding domain srgssr.ch to list
snidust    | [INFO] [SniDust] Adding domain cdn.rts.ch to list
snidust    | [INFO] [SniDust] Adding domain srgsnitch.herokuapp.com to list
snidust    | [INFO] [SniDust] Adding domain srg.live.ott.irdeto.com to list
snidust    | [INFO] [SniDust] *** End of Domain List ***
snidust    | [INFO] [SniDust] *** Domain List: /etc/snidust/domains.d/08-wilmaa.lst***
snidust    | [INFO] [SniDust] Adding domain wilmaa.com to list
snidust    | [INFO] [SniDust] Adding domain wilmaa.wemfbox.ch to list
snidust    | [INFO] [SniDust] Adding domain wilm-ssl.wemfbox.ch to list
snidust    | [INFO] [SniDust] Adding domain user.wilmaa.tvbackbone.com to list
snidust    | [INFO] [SniDust] Adding domain multiscreencache.tvbackbone.com to list
snidust    | [INFO] [SniDust] Adding domain teleboy.ch to list
snidust    | [INFO] [SniDust] Adding domain wilmaa.customers.cdn.iptv.ch to list
snidust    | [INFO] [SniDust] Adding domain teleboy.customers.cdn.iptv.ch to list
snidust    | [INFO] [SniDust] Adding domain cdn.iptv.ch to list
snidust    | [INFO] [SniDust] *** End of Domain List ***
snidust    | [INFO] [SniDust] *** Domain List: /etc/snidust/domains.d/09-zattoo.lst***
snidust    | [INFO] [SniDust] Adding domain zattoohds-a.akamaihd.net to list
snidust    | [INFO] [SniDust] Adding domain zathdslive-a.akamaihd.net to list
snidust    | [INFO] [SniDust] Adding domain zahs.tv to list
snidust    | [INFO] [SniDust] Adding domain zatsslive-a.akamaihd.net to list
snidust    | [INFO] [SniDust] Adding domain chromecast-receiver.zattoo.com to list
snidust    | [INFO] [SniDust] Adding domain box30030.wemfbox.ch to list
snidust    | [INFO] [SniDust] Adding domain zattoo.wemfbox.ch to list
snidust    | [INFO] [SniDust] Adding domain zatsslive-a.akamaihd.net to list
snidust    | [INFO] [SniDust] *** End of Domain List ***
snidust    | [INFO] [SniDust] *** Domain List: /etc/snidust/domains.d/10-yallo.lst***
snidust    | [INFO] [SniDust] Adding domain y3o.tv to list
snidust    | [INFO] [SniDust] *** End of Domain List ***
snidust    | [INFO] [SniDust] *** Domain List: /etc/snidust/domains.d/99-custom.lst***
snidust    | [INFO] [SniDust] Adding domain msn.com
snidust    | [INFO] [SniDust] Adding domain microsoft.com
snidust    | [INFO] [SniDust] *** End of Domain List ***
snidust    | [INFO] [SniDust] *** Complete! ***
snidust    | Added downstream server 8.8.8.8:853
snidust    | Added downstream server 8.8.4.4:853
snidust    | Added downstream server 1.1.1.1:443
snidust    | Added downstream server 1.0.0.1:443
snidust    | Listening on 0.0.0.0:5300
snidust    | ACL allowing queries from: 0.0.0.0/0
snidust    | Console ACL allowing connections from: 127.0.0.0/8, ::1/128
snidust    | Marking downstream cloudflare-dns (1.1.1.1:443) as 'up'
snidust    | Marking downstream cloudflare-dns (1.0.0.1:443) as 'up'
snidust    | Marking downstream dns.google (8.8.4.4:853) as 'up'
snidust    | Marking downstream dns.google (8.8.8.8:853) as 'up'
snidust    | Polled security status of version 1.8.2 at startup, no known issues reported: OK
snidust    | /entrypoint.sh: line 55:    19 Killed                  /usr/local/bin/sniproxy --config "/etc/sniproxy/config.yaml"
snidust    | [WARN] sniproxy crashed with exit code 1. Restarting...
snidust    | 2024-02-16T23:55:06Z INF starting sniproxy. version v2.0.4, commit eecf94a0e8df7eaaaa9946fd21f80e392c9642cdsnidust    | /entrypoint.sh: line 55:   308 Killed                  /usr/local/bin/sniproxy --config "/etc/sniproxy/config.yaml"
snidust    | [WARN] sniproxy crashed with exit code 1. Restarting...
snidust    | 2024-02-17T00:05:42Z INF starting sniproxy. version v2.0.4, commit eecf94a0e8df7eaaaa9946fd21f80e392c9642cdsnidust    | /entrypoint.sh: line 55:   478 Killed                  /usr/local/bin/sniproxy --config "/etc/sniproxy/config.yaml"
snidust    | [WARN] sniproxy crashed with exit code 1. Restarting...
snidust    | 2024-02-17T00:18:36Z INF starting sniproxy. version v2.0.4, commit eecf94a0e8df7eaaaa9946fd21f80e392c9642cdsnidust    | /entrypoint.sh: line 55:   669 Killed                  /usr/local/bin/sniproxy --config "/etc/sniproxy/config.yaml"
snidust    | [WARN] sniproxy crashed with exit code 1. Restarting...
snidust    | 2024-02-17T00:59:43Z INF starting sniproxy. version v2.0.4, commit eecf94a0e8df7eaaaa9946fd21f80e392c9642cdsnidust    | /entrypoint.sh: line 55:  1323 Killed                  /usr/local/bin/sniproxy --config "/etc/sniproxy/config.yaml"
snidust    | [WARN] sniproxy crashed with exit code 1. Restarting...
snidust    | 2024-02-17T01:34:49Z INF starting sniproxy. version v2.0.4, commit eecf94a0e8df7eaaaa9946fd21f80e392c9642cdsnidust    | /entrypoint.sh: line 55:  1871 Killed                  /usr/local/bin/sniproxy --config "/etc/sniproxy/config.yaml"
snidust    | [WARN] sniproxy crashed with exit code 1. Restarting...
snidust    | 2024-02-17T01:54:59Z INF starting sniproxy. version v2.0.4, commit eecf94a0e8df7eaaaa9946fd21f80e392c9642cdsnidust    | /entrypoint.sh: line 55:  2187 Killed                  /usr/local/bin/sniproxy --config "/etc/sniproxy/config.yaml"
snidust    | [WARN] sniproxy crashed with exit code 1. Restarting...
snidust    | 2024-02-17T02:18:03Z INF starting sniproxy. version v2.0.4, commit eecf94a0e8df7eaaaa9946fd21f80e392c9642cdsnidust    | /entrypoint.sh: line 55:  2539 Killed                  /usr/local/bin/sniproxy --config "/etc/sniproxy/config.yaml"
snidust    | [WARN] sniproxy crashed with exit code 1. Restarting...
snidust    | 2024-02-17T02:44:20Z INF starting sniproxy. version v2.0.4, commit eecf94a0e8df7eaaaa9946fd21f80e392c9642cdsnidust    | /entrypoint.sh: line 55:  2941 Killed                  /usr/local/bin/sniproxy --config "/etc/sniproxy/config.yaml"
snidust    | [WARN] sniproxy crashed with exit code 1. Restarting...
snidust    | 2024-02-17T03:30:11Z INF starting sniproxy. version v2.0.4, commit eecf94a0e8df7eaaaa9946fd21f80e392c9642cdsnidust    | /entrypoint.sh: line 55:  3661 Killed                  /usr/local/bin/sniproxy --config "/etc/sniproxy/config.yaml"
snidust    | [WARN] sniproxy crashed with exit code 1. Restarting...
snidust    | 2024-02-17T03:55:26Z INF starting sniproxy. version v2.0.4, commit eecf94a0e8df7eaaaa9946fd21f80e392c9642cdsnidust    | /entrypoint.sh: line 55:  4049 Killed                  /usr/local/bin/sniproxy --config "/etc/sniproxy/config.yaml"
snidust    | [WARN] sniproxy crashed with exit code 1. Restarting...
snidust    | 2024-02-17T04:16:11Z INF starting sniproxy. version v2.0.4, commit eecf94a0e8df7eaaaa9946fd21f80e392c9642cdsnidust    | /entrypoint.sh: line 55:  4352 Killed                  /usr/local/bin/sniproxy --config "/etc/sniproxy/config.yaml"
snidust    | [WARN] sniproxy crashed with exit code 1. Restarting...
snidust    | 2024-02-17T04:23:06Z INF starting sniproxy. version v2.0.4, commit eecf94a0e8df7eaaaa9946fd21f80e392c9642cdsnidust    | /entrypoint.sh: line 55:  4460 Killed                  /usr/local/bin/sniproxy --config "/etc/sniproxy/config.yaml"
snidust    | [WARN] sniproxy crashed with exit code 1. Restarting...
snidust    | 2024-02-17T05:05:16Z INF starting sniproxy. version v2.0.4, commit eecf94a0e8df7eaaaa9946fd21f80e392c9642cdsnidust    | /entrypoint.sh: line 55:  5110 Killed                  /usr/local/bin/sniproxy --config "/etc/sniproxy/config.yaml"
snidust    | [WARN] sniproxy crashed with exit code 1. Restarting...
snidust    | 2024-02-17T05:56:37Z INF starting sniproxy. version v2.0.4, commit eecf94a0e8df7eaaaa9946fd21f80e392c9642cdsnidust    | /entrypoint.sh: line 55:  5903 Killed                  /usr/local/bin/sniproxy --config "/etc/sniproxy/config.yaml"
snidust    | [WARN] sniproxy crashed with exit code 1. Restarting...
snidust    | 2024-02-17T06:00:29Z INF starting sniproxy. version v2.0.4, commit eecf94a0e8df7eaaaa9946fd21f80e392c9642cdsnidust    | /entrypoint.sh: line 55:  5962 Killed                  /usr/local/bin/sniproxy --config "/etc/sniproxy/config.yaml"
snidust    | [WARN] sniproxy crashed with exit code 1. Restarting...
snidust    | 2024-02-17T06:11:09Z INF starting sniproxy. version v2.0.4, commit eecf94a0e8df7eaaaa9946fd21f80e392c9642cdsnidust    | /entrypoint.sh: line 55:  6128 Killed                  /usr/local/bin/sniproxy --config "/etc/sniproxy/config.yaml"
snidust    | [WARN] sniproxy crashed with exit code 1. Restarting...
snidust    | 2024-02-17T06:27:04Z INF starting sniproxy. version v2.0.4, commit eecf94a0e8df7eaaaa9946fd21f80e392c9642cdsnidust    | /entrypoint.sh: line 55:  6382 Killed                  /usr/local/bin/sniproxy --config "/etc/sniproxy/config.yaml"
snidust    | [WARN] sniproxy crashed with exit code 1. Restarting...
snidust    | 2024-02-17T06:35:18Z INF starting sniproxy. version v2.0.4, commit eecf94a0e8df7eaaaa9946fd21f80e392c9642cdsnidust    | /entrypoint.sh: line 55:  6509 Killed                  /usr/local/bin/sniproxy --config "/etc/sniproxy/config.yaml"
snidust    | [WARN] sniproxy crashed with exit code 1. Restarting...
snidust    | 2024-02-17T06:42:10Z INF starting sniproxy. version v2.0.4, commit eecf94a0e8df7eaaaa9946fd21f80e392c9642cdsnidust    | /entrypoint.sh: line 55:  6624 Killed                  /usr/local/bin/sniproxy --config "/etc/sniproxy/config.yaml"
snidust    | [WARN] sniproxy crashed with exit code 1. Restarting...
snidust    | 2024-02-17T06:46:40Z INF starting sniproxy. version v2.0.4, commit eecf94a0e8df7eaaaa9946fd21f80e392c9642cdsnidust    | /entrypoint.sh: line 55:  6689 Killed                  /usr/local/bin/sniproxy --config "/etc/sniproxy/config.yaml"
snidust    | [WARN] sniproxy crashed with exit code 1. Restarting...
snidust    | 2024-02-17T06:58:54Z INF starting sniproxy. version v2.0.4, commit eecf94a0e8df7eaaaa9946fd21f80e392c9642cdsnidust    | /entrypoint.sh: line 55:  6881 Killed                  /usr/local/bin/sniproxy --config "/etc/sniproxy/config.yaml"
snidust    | [WARN] sniproxy crashed with exit code 1. Restarting...
snidust    | 2024-02-17T07:33:03Z INF starting sniproxy. version v2.0.4, commit eecf94a0e8df7eaaaa9946fd21f80e392c9642cdsnidust    | /entrypoint.sh: line 55:  7417 Killed                  /usr/local/bin/sniproxy --config "/etc/sniproxy/config.yaml"
snidust    | [WARN] sniproxy crashed with exit code 1. Restarting...
snidust    | 2024-02-17T08:02:04Z INF starting sniproxy. version v2.0.4, commit eecf94a0e8df7eaaaa9946fd21f80e392c9642cdsnidust    | /entrypoint.sh: line 55:  7867 Killed                  /usr/local/bin/sniproxy --config "/etc/sniproxy/config.yaml"
snidust    | [WARN] sniproxy crashed with exit code 1. Restarting...
snidust    | 2024-02-17T09:30:36Z INF starting sniproxy. version v2.0.4, commit eecf94a0e8df7eaaaa9946fd21f80e392c9642cdroot@v2343182:~/SniDust#
```

**Comment by Seji64** [comment]
Maybe sniproxy gets OOM killed? Is something logged in journald or dmesg?

**Comment by Spaghetti-jpg** [comment]
Yeah, sniproxy was killed by OOM

```
dmesg
[284608.619735] oom-kill:constraint=CONSTRAINT_NONE,nodemask=(null),cpuset=containerd.service,mems_allowed=0,global_oom,task_memcg=/system.slice/docker-bc9cbd704ac7955e5ed1cb33723411c265c740766378ed1e27dfb56e62560c18.scope,task=sniproxy,pid=180416,uid=0
[284608.619762] Out of memory: Killed process 180416 (sniproxy) total-vm:1481096kB, anon-rss:611924kB, file-rss:0kB, shmem-rss:0kB, UID:0 pgtables:1612kB oom_score_adj:0
[284609.900176] net_ratelimit: 17449 callbacks suppressed
[284609.900182] TCP: too many orphaned sockets
[284609.900267] TCP: too many orphaned sockets
[284609.900363] TCP: too many orphaned sockets
[284609.900376] TCP: too many orphaned sockets
[284609.900439] TCP: too many orphaned sockets
[284609.900453] TCP: too many orphaned sockets
[284609.900515] TCP: too many orphaned sockets
[284609.900529] TCP: too many orphaned sockets
[284609.900586] TCP: too many orphaned sockets
[284609.900610] TCP: too many orphaned sockets
```

docker logs
```
snidust    | [INFO] [SniDust] *** End of Domain List ***
snidust    | [INFO] [SniDust] Domain Lists reloaded!
snidust    | /entrypoint.sh: line 55:    19 Killed                  /usr/local/bin/sniproxy --config "/etc/sniproxy/config.yaml"
snidust    | [WARN] sniproxy crashed with exit code 1. Restarting...
snidust    | 2024-02-19T19:59:58Z INF starting sniproxy. version v2.0.4, commit eecf94a0e8df7eaaaa9946fd21f80e392c9642cd
snidust    | /entrypoint.sh: line 55:   187 Killed                  /usr/local/bin/sniproxy --config "/etc/sniproxy/config.yaml"
snidust    | [WARN] sniproxy crashed with exit code 1. Restarting...
snidust    | 2024-02-19T20:36:33Z INF starting sniproxy. version v2.0.4, commit eecf94a0e8df7eaaaa9946fd21f80e392c9642cd
snidust    | /entrypoint.sh: line 55:   759 Killed                  /usr/local/bin/sniproxy --config "/etc/sniproxy/config.yaml"
snidust    | [WARN] sniproxy crashed with exit code 1. Restarting...
snidust    | 2024-02-19T20:40:55Z INF starting sniproxy. version v2.0.4, commit eecf94a0e8df7eaaaa9946fd21f80e392c9642cd
snidust    | /entrypoint.sh: line 55:   828 Killed                  /usr/local/bin/sniproxy --config "/etc/sniproxy/config.yaml"
snidust    | [WARN] sniproxy crashed with exit code 1. Restarting...
snidust    | 2024-02-19T21:04:56Z INF starting sniproxy. version v2.0.4, commit eecf94a0e8df7eaaaa9946fd21f80e392c9642cd
snidust    | /entrypoint.sh: line 55:  1210 Killed                  /usr/local/bin/sniproxy --config "/etc/sniproxy/config.yaml"
snidust    | [WARN] sniproxy crashed with exit code 1. Restarting...
snidust    | 2024-02-19T21:39:09Z INF starting sniproxy. version v2.0.4, commit eecf94a0e8df7eaaaa9946fd21f80e392c9642cd
snidust    | /entrypoint.sh: line 55:  1730 Killed                  /usr/local/bin/sniproxy --config "/etc/sniproxy/config.yaml"
snidust    | [WARN] sniproxy crashed with exit code 1. Restarting...
snidust    | 2024-02-19T21:58:24Z INF starting sniproxy. version v2.0.4, commit eecf94a0e8df7eaaaa9946fd21f80e392c9642cd
```

**Comment by Seji64** [comment]
How much RAM does your VPS / Server have? I have not much load on my SniDust instance, but i had never this kind of issue.

**Comment by Pachini** [comment]
Same problem here and I know why
if ANYONE will do http request with server ip HTTP: GET / HTTP/1.1 snidust instantly falls into an infinite loop

tcpdump:

```
20:04:07.991292 eth0  In  IP 45.86.229.244.49548 > 5.161.198.251.80: Flags [S], seq 466288105, win 64240, options [mss 1460,sackOK,TS val 1007446571 ecr 0,nop,wscale 7], length 0
20:04:07.991330 br-c8f6d363995f Out IP 45.86.229.244.49548 > 172.18.0.2.80: Flags [S], seq 466288105, win 64240, options [mss 1460,sackOK,TS val 1007446571 ecr 0,nop,wscale 7], length 0
20:04:07.991337 veth8a72bfb Out IP 45.86.229.244.49548 > 172.18.0.2.80: Flags [S], seq 466288105, win 64240, options [mss 1460,sackOK,TS val 1007446571 ecr 0,nop,wscale 7], length 0
20:04:07.991363 veth8a72bfb P   IP 172.18.0.2.80 > 45.86.229.244.49548: Flags [S.], seq 3337158364, ack 466288106, win 65160, options [mss 1460,sackOK,TS val 1288683790 ecr 1007446571,nop,wscale 7], length 0
20:04:07.991367 br-c8f6d363995f In  IP 172.18.0.2.80 > 45.86.229.244.49548: Flags [S.], seq 3337158364, ack 466288106, win 65160, options [mss 1460,sackOK,TS val 1288683790 ecr 1007446571,nop,wscale 7], length 0
20:04:07.991372 eth0  Out IP 5.161.198.251.80 > 45.86.229.244.49548: Flags [S.], seq 3337158364, ack 466288106, win 65160, options [mss 1460,sackOK,TS val 1288683790 ecr 1007446571,nop,wscale 7], length 0
20:04:08.102234 eth0  In  IP 45.86.229.244.49548 > 5.161.198.251.80: Flags [.], ack 1, win 502, options [nop,nop,TS val 1007446682 ecr 1288683790], length 0
20:04:08.102263 br-c8f6d363995f Out IP 45.86.229.244.49548 > 172.18.0.2.80: Flags [.], ack 1, win 502, options [nop,nop,TS val 1007446682 ecr 1288683790], length 0
20:04:08.102270 veth8a72bfb Out IP 45.86.229.244.49548 > 172.18.0.2.80: Flags [.], ack 1, win 502, options [nop,nop,TS val 1007446682 ecr 1288683790], length 0
20:04:08.102710 eth0  In  IP 45.86.229.244.49548 > 5.161.198.251.80: Flags [P.], seq 1:421, ack 1, win 502, options [nop,nop,TS val 1007446682 ecr 1288683790], length 420: HTTP: GET / HTTP/1.1
20:04:08.102718 br-c8f6d363995f Out IP 45.86.229.244.49548 > 172.18.0.2.80: Flags [P.], seq 1:421, ack 1, win 502, options [nop,nop,TS val 1007446682 ecr 1288683790], length 420: HTTP: GET / HTTP/1.1
20:04:08.102721 veth8a72bfb Out IP 45.86.229.244.49548 > 172.18.0.2.80: Flags [P.], seq 1:421, ack 1, win 502, options [nop,nop,TS val 1007446682 ecr 1288683790], length 420: HTTP: GET / HTTP/1.1
20:04:08.102736 veth8a72bfb P   IP 172.18.0.2.80 > 45.86.229.244.49548: Flags [.], ack 421, win 506, options [nop,nop,TS val 1288683901 ecr 1007446682], length 0
20:04:08.102741 br-c8f6d363995f In  IP 172.18.0.2.80 > 45.86.229.244.49548: Flags [.], ack 421, win 506, options [nop,nop,TS val 1288683901 ecr 1007446682], length 0
20:04:08.102747 eth0  Out IP 5.161.198.251.80 > 45.86.229.244.49548: Flags [.], ack 421, win 506, options [nop,nop,TS val 1288683901 ecr 1007446682], length 0
20:04:08.103053 veth8a72bfb P   IP 172.18.0.2.45076 > 5.161.198.251.80: Flags [S], seq 835487573, win 64240, options [mss 1460,sackOK,TS val 2007221226 ecr 0,nop,wscale 7], length 0
20:04:08.103074 br-c8f6d363995f In  IP 172.18.0.2.45076 > 5.161.198.251.80: Flags [S], seq 835487573, win 64240, options [mss 1460,sackOK,TS val 2007221226 ecr 0,nop,wscale 7], length 0
20:04:08.103097 br-c8f6d363995f Out IP 5.161.198.251.80 > 172.18.0.2.45076: Flags [S.], seq 334357068, ack 835487574, win 65160, options [mss 1460,sackOK,TS val 3797011594 ecr 2007221226,nop,wscale 7], length 0
20:04:08.103100 veth8a72bfb Out IP 5.161.198.251.80 > 172.18.0.2.45076: Flags [S.], seq 334357068, ack 835487574, win 65160, options [mss 1460,sackOK,TS val 3797011594 ecr 2007221226,nop,wscale 7], length 0
20:04:08.103116 veth8a72bfb P   IP 172.18.0.2.45076 > 5.161.198.251.80: Flags [.], ack 1, win 502, options [nop,nop,TS val 2007221226 ecr 3797011594], length 0
20:04:08.103118 br-c8f6d363995f In  IP 172.18.0.2.45076 > 5.161.198.251.80: Flags [.], ack 1, win 502, options [nop,nop,TS val 2007221226 ecr 3797011594], length 0
20:04:08.103261 veth8a72bfb P   IP 172.18.0.2.45076 > 5.161.198.251.80: Flags [P.], seq 1:367, ack 1, win 502, options [nop,nop,TS val 2007221227 ecr 3797011594], length 366: HTTP: GET / HTTP/1.1
20:04:08.103264 br-c8f6d363995f In  IP 172.18.0.2.45076 > 5.161.198.251.80: Flags [P.], seq 1:367, ack 1, win 502, options [nop,nop,TS val 2007221227 ecr 3797011594], length 366: HTTP: GET / HTTP/1.1
20:04:08.103269 br-c8f6d363995f Out IP 5.161.198.251.80 > 172.18.0.2.45076: Flags [.], ack 367, win 507, options [nop,nop,TS val 3797011595 ecr 2007221227], length 0
20:04:08.103270 veth8a72bfb Out IP 5.161.198.251.80 > 172.18.0.2.45076: Flags [.], ack 367, win 507, options [nop,nop,TS val 3797011595 ecr 2007221227], length 0
20:04:08.103439 br-c8f6d363995f Out IP 172.18.0.1.41696 > 172.18.0.2.80: Flags [S], seq 1464475819, win 64240, options [mss 1460,sackOK,TS val 558437229 ecr 0,nop,wscale 7], length 0
20:04:08.103440 veth8a72bfb Out IP 172.18.0.1.41696 > 172.18.0.2.80: Flags [S], seq 1464475819, win 64240, options [mss 1460,sackOK,TS val 558437229 ecr 0,nop,wscale 7], length 0
20:04:08.103451 veth8a72bfb P   IP 172.18.0.2.80 > 172.18.0.1.41696: Flags [S.], seq 2970199944, ack 1464475820, win 65160, options [mss 1460,sackOK,TS val 876148646 ecr 558437229,nop,wscale 7], length 0
20:04:08.103452 br-c8f6d363995f In  IP 172.18.0.2.80 > 172.18.0.1.41696: Flags [S.], seq 2970199944, ack 1464475820, win 65160, options [mss 1460,sackOK,TS val 876148646 ecr 558437229,nop,wscale 7], length 0
20:04:08.103459 br-c8f6d363995f Out IP 172.18.0.1.41696 > 172.18.0.2.80: Flags [.], ack 1, win 502, options [nop,nop,TS val 558437229 ecr 876148646], length 0
20:04:08.103459 veth8a72bfb Out IP 172.18.0.1.41696 > 172.18.0.2.80: Flags [.], ack 1, win 502, options [nop,nop,TS val 558437229 ecr 876148646], length 0
20:04:08.103545 br-c8f6d363995f Out IP 172.18.0.1.41696 > 172.18.0.2.80: Flags [P.], seq 1:367, ack 1, win 502, options [nop,nop,TS val 558437229 ecr 876148646], length 366: HTTP: GET / HTTP/1.1
20:04:08.103546 veth8a72bfb Out IP 172.18.0.1.41696 > 172.18.0.2.80: Flags [P.], seq 1:367, ack 1, win 502, options [nop,nop,TS val 558437229 ecr 876148646], length 366: HTTP: GET / HTTP/1.1
```

and after some time in snidust logs

```
2024-03-31T06:13:50Z ERR EOF service=http
2024-03-31T06:13:50Z ERR EOF service=http
2024-03-31T06:13:50Z ERR EOF service=http
2024-03-31T06:13:50Z ERR EOF service=http
2024-03-31T06:13:50Z ERR EOF service=http
2024-03-31T06:13:50Z ERR EOF service=http
2024-03-31T06:13:50Z ERR EOF service=http
2024-03-31T06:13:50Z ERR EOF service=http
2024-03-31T06:13:50Z ERR EOF service=http
```

So, snidust can survive if server will have ~4GB ram, but  moment it goes into an infinite loop, it eats up 4GB of memory minimum and floods the server with endless connections to itself

**Comment by Seji64** [comment]
Hm, as the dev of the sniproxy Version we are using here is no longer active and so the root cause won't get fixed soon, its maybe better to Switch back to the plain old Version of sniproxy

**Comment by Seji64** [comment]
please note replacing sniproxy with nginx resulted in a **breaking change**. nginx is listening on port **8080** (before 80) and **8443** (before 443). Ensure you update your docker configuration accordingly!
